{
  "$schema": "../schema/playlist.schema.json",
  "id": "book_01_lessons",
  "title": "Book 1 — Foundations",
  "kind": "curriculum",
  "description": "YouTube / site playlist order for Book 1 lessons.",
  "status": "planned",
  "youtube_playlist_id": null,
  "cover": "media/books/book_01/cover.png",
  "items": [
    { "lesson_id": "lesson_001", "ord": 1 },
    { "lesson_id": "lesson_002", "ord": 2 }
  ]
}
